Frase,Cançó,Disc
"Amb el canvi de paradigma preferia els segons plans,
ja no estava mai segur del que pensava.",CANVI DE PARADIGMA,PER LA BONA GENT (2019)
"T’agraeixo les flors blanques i el discurs al funeral,
sé que feia temps que ja no em respectaves.",CANVI DE PARADIGMA,PER LA BONA GENT (2019)
"Aquí estic, en ple control dels meus instints",PER LA BONA GENT,PER LA BONA GENT (2019)
"Tranquil, 
que en cap arma hi trobaràs empremtes dels meus dits",PER LA BONA GENT,PER LA BONA GENT (2019)
"que encara no he dit si soc bo, encara no saps si soc bo,
encara no he dit que m’inspiri una idea, que em mogui una gran convicció",PER LA BONA GENT,PER LA BONA GENT (2019)
encara no saps si amb el meu pas pel món faig que sigui una mica millor,PER LA BONA GENT,PER LA BONA GENT (2019)
Encara no saps si soc bo. Encara no he dit si soc bo.,PER LA BONA GENT,PER LA BONA GENT (2019)
"Encara no saps si em domina la mandra, si estic espatllat per la por.",PER LA BONA GENT,PER LA BONA GENT (2019)
Encara no he dit si tinc l’ànima pura o si em vencen les baixes passions.,PER LA BONA GENT,PER LA BONA GENT (2019)
Tinc una veïna que fa dies que assaja el mateix monòleg al balcó,AQUÍ TENS EL MEU BRAÇ,PER LA BONA GENT (2019)
"Si alguna cosa volem la meva gent i jo
no és servir d’exemple, no és tenir raó.",ELS ENTUSIASMATS,PER LA BONA GENT (2019)
"Aquí volem viure entusiasmats,
aquí prenem focs que ens incendiïn la sensibilitat.",ELS ENTUSIASMATS,PER LA BONA GENT (2019)
"I busco en llocs on, per ’nar bé, no hauria de buscar!",TUBS DE VENTILACIÓ,PER LA BONA GENT (2019)
"Les estrelles venen, van,
cremen ràpid o amb els anys, 
i, com els últims raigs del sol, desapareixen.",LES ESTRELLES,PER LA BONA GENT (2019)
"De lluny es veu la glòria, 
però no serveix de molt si no es sap compartir",LES ESTRELLES,PER LA BONA GENT (2019)
"De com es perd la gent
per uns aplaudiments.",LES ESTRELLES,PER LA BONA GENT (2019)
"Però tant se val, 
això no és el que he vingut a dir,
jo vull explicar una història,
perquè tots tenim històries.",LES ESTRELLES,PER LA BONA GENT (2019)
"La vida ha estat cruenta i fugaç
però, com passar-ho bé, noi, 
ho sabien les cosines.",LES COSINES,JO COMPETEIXO (2016)
"Quan el pare preguntava “quina feina trobaràs?”,
la meva amiga, rabiosa, intentava no plorar
i el cervell jove repassava les opcions
i tenia els ulls cansats de mirar en tots els racons
però, en mirar-lo, el camí no diu si vas a la glòria o al fracàs.",CANÇÓ DEL DUBTE,JO COMPETEIXO (2016)
Desgraciats si sabeu el gust que fan els petons que fem dubtant!,CANÇÓ DEL DUBTE,JO COMPETEIXO (2016)
Ha aparegut el diable en un revolt de Collserola.,TEMPTACIONS DE COLLSEROLA,JO COMPETEIXO (2016)
"Assumim els perills, 
n’aguantem els embats
i avancem pels camins
de les guineus i dels senglars.",TEMPTACIONS DE COLLSEROLA,JO COMPETEIXO (2016)
"I vagis on vagis, o sigui on sigui que et penses que vas,
mai has desafiat tant la lògica elemental.",M’HI VAIG LLANÇAR,JO COMPETEIXO (2016)
Clar que arriben dies on tothom li sembla imbècil i opta per callar.,L’ESPECTRE DE MARIA ANTONIETA,JO COMPETEIXO (2016)
I ha trobat un nom bonic per a cada rata.,BBVA,JO COMPETEIXO (2016)
"I no em posaré de genolls. 
I ja m’he posat de genolls.",SABOTATGE,JO COMPETEIXO (2016)
Fas veure que penses però saps molt bé el que fas!,SABOTATGE,JO COMPETEIXO (2016)
"Mami mira amunt, mami mira amunt (que hi ha un satèl·lit que ens espia)",LA SEROTONINA,JO COMPETEIXO (2016)
les velles es xapen de riure,LA SEROTONINA,JO COMPETEIXO (2016)
Quan caigui sobre teu la còlera dels déus i no quedi res a dir,"AVANÇA, VIANANT",JO COMPETEIXO (2016)
"Quan cada error al món, quan cada pas en fals, contingui més veritat
que el feix depriment de fulls intactes del teu currículum immaculat,","AVANÇA, VIANANT",JO COMPETEIXO (2016)
Tots ens movem! No pots quedar-te encallat eternament!,"AVANÇA, VIANANT",JO COMPETEIXO (2016)
"Però tu sabràs el que fas, jo vindria a practicar el noble art d’anar endavant.","AVANÇA, VIANANT",JO COMPETEIXO (2016)
"i no se sap si malgrat l’esforç anem
cap al plaer o al dolor, a la llum o a la foscor, a un gran banquet o a la més cruel inanició.","AVANÇA, VIANANT",JO COMPETEIXO (2016)
"Que hi hagi pau, que hi hagi pau, que hi hagi pau damunt la  Terra.","AVANÇA, VIANANT",JO COMPETEIXO (2016)
"Creu en el món, creu en el món, creu en la gent que no coneixes.","AVANÇA, VIANANT",JO COMPETEIXO (2016)
"Quan la derrota és segura uns dissimulen, uns capitulen
i jo competeixo.",JO COMPETEIXO,JO COMPETEIXO (2016)
"I uns altres la van trobar un dia que, per casualitat,
van saber donar sense esperar rebre,
o van saber tenir sense témer perdre…",JO COMPETEIXO,JO COMPETEIXO (2016)
Puc veure que aneu bellament armats per a la batalla!,JO COMPETEIXO,JO COMPETEIXO (2016)
"per fer els comentaris més profunds, per fer els comentaris més banals,",JO COMPETEIXO,JO COMPETEIXO (2016)
"Quan la derrota és enorme hi ha qui reconeix les forces de l’ordre i jo,
que competeixo.",JO COMPETEIXO,JO COMPETEIXO (2016)
Que aquí es tracta d’estar disposat a entomar una bala!,JO COMPETEIXO,JO COMPETEIXO (2016)
Que aquí es tracta de ser capità de iots que naufraguen!,JO COMPETEIXO,JO COMPETEIXO (2016)
Què podreu deixar enrere quan calgui? Què voldreu sacrificar a canvi?,JO COMPETEIXO,JO COMPETEIXO (2016)
"o xiulareu cançons que uns tarats hauran 
escrit sobre les vostres gestes.",JO COMPETEIXO,JO COMPETEIXO (2016)
"I, amics, la destral de guerra mai s’enterra",JO COMPETEIXO,JO COMPETEIXO (2016)
"I, amics, la destral de guerra mai s’enterra;
s’amaga en el calaix més elevat del menjador,
es lloga per hores, es ven al millor postor,
se li diu a un germà que te la guardi una temporada,
es dóna al museu de seguretat més relaxada,
però mai s’enterra, mai s’enterra 
i s’esmola en la fosca,",JO COMPETEIXO,JO COMPETEIXO (2016)
"Mireu on trepitgeu, temeu la foscor, que rebento autoestimes com si fossin sabó.",JO COMPETEIXO,JO COMPETEIXO (2016)
Seré un udol que us deixarà la sang congelada!,JO COMPETEIXO,JO COMPETEIXO (2016)
"Seré el gran savi que us explicarà
la lliçó d’amb qui es pot i amb qui no es pot jugar.",JO COMPETEIXO,JO COMPETEIXO (2016)
"però,
si us hi fixeu, porto el somriure de qui s’aguanta una riallada.",JO COMPETEIXO,JO COMPETEIXO (2016)
"Que quan la derrota és molt clara hi ha qui busca lloc en una altra banda
i jo, que competeixo.",JO COMPETEIXO,JO COMPETEIXO (2016)
Jo et reconec que em van convèncer amb facilitat.,"AI, YOKO","ATLETES, BAIXIN DE L'ESCENARI (2013)"
"Però avui he entès que us estimàveu
com molts no haurem estimat mai.","AI, YOKO","ATLETES, BAIXIN DE L'ESCENARI (2013)"
Per molt que ho intenti hi ha coses que no puc canviar.,"AI, YOKO","ATLETES, BAIXIN DE L'ESCENARI (2013)"
Per molt que m’hi esforci he anat predicant tantes barbaritats.,"AI, YOKO","ATLETES, BAIXIN DE L'ESCENARI (2013)"
"I és que si, en general, tots els canvis ja em posen tan nerviós","AI, YOKO","ATLETES, BAIXIN DE L'ESCENARI (2013)"
i entre la teva cara rara que de nen em feia por,"AI, YOKO","ATLETES, BAIXIN DE L'ESCENARI (2013)"
"I t’ho explico, així, covard, aprofitant que ell no ens sent","AI, YOKO","ATLETES, BAIXIN DE L'ESCENARI (2013)"
Llavors ja era fort i no perdia mai la calma,JA ERA FORT,"ATLETES, BAIXIN DE L'ESCENARI (2013)"
"No ploris, nen, que no sabré què dir. No ploris, nen, que ets més bonic quan rius.",JA ERA FORT,"ATLETES, BAIXIN DE L'ESCENARI (2013)"
O és que vostè no està d’acord amb mi?,JA ERA FORT,"ATLETES, BAIXIN DE L'ESCENARI (2013)"
"Creus que els faria gràcia saber que, amb tant de temps, 
des de tan lluny pensem en ells?",BANDA DE ROCK,"ATLETES, BAIXIN DE L'ESCENARI (2013)"
"i gairebé res ha canviat,
només que ara, ja no les fan?",BANDA DE ROCK,"ATLETES, BAIXIN DE L'ESCENARI (2013)"
"Sabran que almenys per a tu i per a mi
durant un temps van fer que tot
fos una mica més divertit?",BANDA DE ROCK,"ATLETES, BAIXIN DE L'ESCENARI (2013)"
I aquella idea il•legal m’anava inundant el cap,DEIXAR-TE UN DIA,"ATLETES, BAIXIN DE L'ESCENARI (2013)"
"Només esperava, en silenci, que es presentés el moment
de fer-ho volar tot pels aires fent veure que era un accident.",DEIXAR-TE UN DIA,"ATLETES, BAIXIN DE L'ESCENARI (2013)"
"Sabeu el meu futur? Avui li he disparat amb munició de plata 
apuntant directe al cor.",DEIXAR-TE UN DIA,"ATLETES, BAIXIN DE L'ESCENARI (2013)"
"Hi arribava que era nit tancada, que en alguna taverna del centre s’havia fet tard.",MORT D'UN HEROI ROMÀNTIC,"ATLETES, BAIXIN DE L'ESCENARI (2013)"
"A la llum d’un immens canelobre, vaig obrir-me pas en la foscor.",MORT D'UN HEROI ROMÀNTIC,"ATLETES, BAIXIN DE L'ESCENARI (2013)"
I tenia una nota ridícula arrugada entre les mans,MORT D'UN HEROI ROMÀNTIC,"ATLETES, BAIXIN DE L'ESCENARI (2013)"
"Al carrer la carrossa esperava, el cotxer es distreia observant
uns soldats de permís que cantaven sota la llum dels fanals",MORT D'UN HEROI ROMÀNTIC,"ATLETES, BAIXIN DE L'ESCENARI (2013)"
Vam comptar fins a tres per fer força per pujar el cadàver a dalt.,MORT D'UN HEROI ROMÀNTIC,"ATLETES, BAIXIN DE L'ESCENARI (2013)"
"Plena de dones rient, d’ulls sanguinolents, de bellesa que no deixa espai per pensar.",MORT D'UN HEROI ROMÀNTIC,"ATLETES, BAIXIN DE L'ESCENARI (2013)"
Uns macarres us saluden al semàfor i somrius,TERESA RAMPELL,"ATLETES, BAIXIN DE L'ESCENARI (2013)"
Que ve l’Amor ressonant com un exèrcit de timbals!,TERESA RAMPELL,"ATLETES, BAIXIN DE L'ESCENARI (2013)"
L’Amor ja es va propagant com un incendi forestal!,TERESA RAMPELL,"ATLETES, BAIXIN DE L'ESCENARI (2013)"
"Desplaça tot el teu talent, conscient de cadascun dels moviments.",TERESA RAMPELL,"ATLETES, BAIXIN DE L'ESCENARI (2013)"
i passa un enemic i feu les paus amb un brindis de cubates,TERESA RAMPELL,"ATLETES, BAIXIN DE L'ESCENARI (2013)"
"A les teles interrompen uns minuts els videoclips
i ara hi surt un periodista estressat pels teletips",TERESA RAMPELL,"ATLETES, BAIXIN DE L'ESCENARI (2013)"
I reconeixes una força antiga i sense discussió t’hi entregaràs,TERESA RAMPELL,"ATLETES, BAIXIN DE L'ESCENARI (2013)"
i ets un nàufrag que ha decidit tastar l’aigua salada,TERESA RAMPELL,"ATLETES, BAIXIN DE L'ESCENARI (2013)"
"Prova somriure davant del mirall, 
que ara tenim una oportunitat.",A VEURE QUÈ EN FEM,"ATLETES, BAIXIN DE L'ESCENARI (2013)"
"i van deixar-nos aquesta veritat
que em sap molt greu, però per sempre sabràs:
pots agafar-la o deixar-la passar
però ara tenim una oportunitat.",A VEURE QUÈ EN FEM,"ATLETES, BAIXIN DE L'ESCENARI (2013)"
"Tenim una oportunitat. 
Ha, ha, ha! A veure què en fem.",A VEURE QUÈ EN FEM,"ATLETES, BAIXIN DE L'ESCENARI (2013)"
"Vaig entrar a la festa, l’amfitrió em va presentar els convidats.",DESAPAREIXÍEM LENTAMENT,"ATLETES, BAIXIN DE L'ESCENARI (2013)"
Vaig pujar a un arbre amb l’ambició de veure el Llobregat.,DESAPAREIXÍEM LENTAMENT,"ATLETES, BAIXIN DE L'ESCENARI (2013)"
"Les noies joves de la vila se’m van quedar mirant de lluny, rient.",DESAPAREIXÍEM LENTAMENT,"ATLETES, BAIXIN DE L'ESCENARI (2013)"
Mai vaig dir-li en què pensava l’hemisferi més cabró del meu cervell,DESAPAREIXÍEM LENTAMENT,"ATLETES, BAIXIN DE L'ESCENARI (2013)"
La dolça Adela va venir amb el mapa d’un lloc nou per descobrir,"QUIN DIA FEIA, AMICS...","ATLETES, BAIXIN DE L'ESCENARI (2013)"
"i fes-me petons, desconegut, fes-me petons",FES-ME PETONS,"ATLETES, BAIXIN DE L'ESCENARI (2013)"
Un cop a la setena planta vaig saludar la secretària,UN DIRECTIU EM VA ACOMIADAR,"ATLETES, BAIXIN DE L'ESCENARI (2013)"
"I hauria pogut fotre amb el peu la porta avall,",UN DIRECTIU EM VA ACOMIADAR,"ATLETES, BAIXIN DE L'ESCENARI (2013)"
no has calculat que estic molt boig. En guàrdia! En guàrdia!,UN DIRECTIU EM VA ACOMIADAR,"ATLETES, BAIXIN DE L'ESCENARI (2013)"
"i un directiu em va acomiadar.
Jo l’obeïa i em va acomiadar.",UN DIRECTIU EM VA ACOMIADAR,"ATLETES, BAIXIN DE L'ESCENARI (2013)"
"I hauria pogut portar un barret ben divertit,
reptar-lo a un duel i requerir l’espasa,",UN DIRECTIU EM VA ACOMIADAR,"ATLETES, BAIXIN DE L'ESCENARI (2013)"
"Benvolgut, permet-me suposar que, malgrat que no haguem gaudit de presentació oficial,més o menys, així com jo, estàs assabentat de la meva existència, de les coses que faig.",BENVOLGUT,10 MILLES PER VEURE UNA BONA ARMADURA (2011)
"Però sí que et vaig veient en discos que al final no et vas enduri alguns quina meravella, i alguns que mai tindràs prou lluny",BENVOLGUT,10 MILLES PER VEURE UNA BONA ARMADURA (2011)
"I, benvolgut, ni sospiteu que gent com joestem esperant.",BENVOLGUT,10 MILLES PER VEURE UNA BONA ARMADURA (2011)
"Amagat en mentidetes, en dubtes emprenyadors, en cada intuïció fugaç d’una vida millor",BENVOLGUT,10 MILLES PER VEURE UNA BONA ARMADURA (2011)
"Benvolgut, que ha arribat i es vol quedar!",BENVOLGUT,10 MILLES PER VEURE UNA BONA ARMADURA (2011)
"Benvolgut, ho deixo aquí, que sé que ets un home ocupat.",BENVOLGUT,10 MILLES PER VEURE UNA BONA ARMADURA (2011)
"Farem adéu i marxarem i ella em dirà que t’ha vist velli,",BENVOLGUT,10 MILLES PER VEURE UNA BONA ARMADURA (2011)
"pas a pas, ja estaràs tan llunycom el cretí que abans d’entrar a Història li tocava el cul",BENVOLGUT,10 MILLES PER VEURE UNA BONA ARMADURA (2011)
"Ai, pobrets meus, com s’haguessin espantat, si entre els matolls, sortim tu i jo dient “ei, aquí els senyors, estem esperant.”",BENVOLGUT,10 MILLES PER VEURE UNA BONA ARMADURA (2011)
"Xicots, aneu fent lloc, que estem esperant",BENVOLGUT,10 MILLES PER VEURE UNA BONA ARMADURA (2011)
"I no és que hi entengui molt, el soldadet, però, que volin els falciots,deurà voler dir que la terra és a prop",LA CANÇO DEL SOLDADET,10 MILLES PER VEURE UNA BONA ARMADURA (2011)
es onades m’arrossegaran i mil peixos de colors lluitaran per devorar la meva carn,LA CANÇO DEL SOLDADET,10 MILLES PER VEURE UNA BONA ARMADURA (2011)
"I és quan pensa “jo m’amago; quan no mirin, jo m’amago”",LA CANÇO DEL SOLDADET,10 MILLES PER VEURE UNA BONA ARMADURA (2011)
"Aniré a ma mare ben vestit i, abans que res, li hauré de dirque em perdoni per tractar-la sempre així",LA CANÇO DEL SOLDADET,10 MILLES PER VEURE UNA BONA ARMADURA (2011)
" aniré a la Margarida a fer-li un fill per, només veure’l, intuir que l’estimo més del que m’estimo a mi",LA CANÇO DEL SOLDADET,10 MILLES PER VEURE UNA BONA ARMADURA (2011)
"Que això nens cau, que això nens cau!",EL GRAN SALT,10 MILLES PER VEURE UNA BONA ARMADURA (2011)
En els teus ulls il·luminats ja s’intueix la immensitat de tot un món al teu abast.,EL GRAN SALT,10 MILLES PER VEURE UNA BONA ARMADURA (2011)
"Va arribar el tiet amb barba llarga, els avis feien dinar especial",BOOMERANG,10 MILLES PER VEURE UNA BONA ARMADURA (2011)
"I l’Ignasi i jo li escoltàvem mil aventures de països llunyansi estaven bé, i eren distretes, però era difícil treure’s del cap el fer volar per damunt del barri aquell regal estrany.",BOOMERANG,10 MILLES PER VEURE UNA BONA ARMADURA (2011)
Però el boomerang s’encallava entre les branques i no tornava mai.,BOOMERANG,10 MILLES PER VEURE UNA BONA ARMADURA (2011)
"I, senyors, tan bo és insistir com saber-se retirar",BOOMERANG,10 MILLES PER VEURE UNA BONA ARMADURA (2011)
I en aquest món entre els meus forts no hi haurà mai els detalls,BOOMERANG,10 MILLES PER VEURE UNA BONA ARMADURA (2011)
"que la infantesa serà divertida, màgica, lliure, d’acord, acceptat, però no hi ha tant temps per perdre i, tard o d’hora, només queda una veritat",BOOMERANG,10 MILLES PER VEURE UNA BONA ARMADURA (2011)
I ens crido: “Treu-te la disfressa i revela qui ets!No em crec que sigueu la vida que ens estem perdent”,LA BOLA DE CRISTALL,10 MILLES PER VEURE UNA BONA ARMADURA (2011)
"Va, assumim-ho, els dies bons gairebé som invencibles!",LA BOLA DE CRISTALL,10 MILLES PER VEURE UNA BONA ARMADURA (2011)
"“Amor meu, sempre hi seré, amor meu, com ho dubtaves?”",LA BOLA DE CRISTALL,10 MILLES PER VEURE UNA BONA ARMADURA (2011)
Que la vida que ens hem perdut simplement no existeix,LA BOLA DE CRISTALL,10 MILLES PER VEURE UNA BONA ARMADURA (2011)
"i jo, en el fons, m’acabava el culet de la copa decidit a trobar un raconet adequat per fer-me petit, petit.",ANIVERSARI,10 MILLES PER VEURE UNA BONA ARMADURA (2011)
i esprintar maleint la llargada dels meus nous passets i amagar-me entre un tap de suro i la paret just a temps que no em mengi el collons de gatet.,ANIVERSARI,10 MILLES PER VEURE UNA BONA ARMADURA (2011)
i accedir al teu desig travessant la paret del llagrimal.,ANIVERSARI,10 MILLES PER VEURE UNA BONA ARMADURA (2011)
I ja dins del desig veure si hi ha bon ambient,ANIVERSARI,10 MILLES PER VEURE UNA BONA ARMADURA (2011)
"I en el núvol de somnis que tens a l’abast i entre d’altres que, ho sento, però ja mai viuràs",ANIVERSARI,10 MILLES PER VEURE UNA BONA ARMADURA (2011)
"relaxar-me celebrant el plaer indescriptible que és estar amb tu, avui que et fas gran, mentre a fora de l’ull les espelmes es van apagant.",ANIVERSARI,10 MILLES PER VEURE UNA BONA ARMADURA (2011)
Ja hem entès que ets una ànima errant que abandona les cases quan tothom dorm,FLOR GROGA,10 MILLES PER VEURE UNA BONA ARMADURA (2011)
que t’agrada menjar quan hi ha gana i dormir si ve son,FLOR GROGA,10 MILLES PER VEURE UNA BONA ARMADURA (2011)
"Però pensa’t-ho bé que després, tard o d’hora, sempre arriba el moment quan s’obre com una flor rara el penediment",FLOR GROGA,10 MILLES PER VEURE UNA BONA ARMADURA (2011)
"i entens, com si totes les bruixes del món coincidissin llegint-te el futur",FLOR GROGA,10 MILLES PER VEURE UNA BONA ARMADURA (2011)
Ja hem previst que només moriràs si algú et clava una daga daurada en el cor,FLOR GROGA,10 MILLES PER VEURE UNA BONA ARMADURA (2011)
i que on t’enterri una bona gent hi creixerà un roure fort,FLOR GROGA,10 MILLES PER VEURE UNA BONA ARMADURA (2011)
"Si em llevés i fos rei, reuniria les Corts per incloure en el codi penal que es prohibeixi a la gent ‘nar pel món buscant res que no pugui anomenar.",FLOR GROGA,10 MILLES PER VEURE UNA BONA ARMADURA (2011)
"Rebràs tracte de senyora, o de iaia estranya que té acollonits tots els nens del veïnat.",CRITICAREM LES NOVES MODES DE PENTINATS,10 MILLES PER VEURE UNA BONA ARMADURA (2011)
I els moments de mirar enrere et faran gràcia i et faran mal.,CRITICAREM LES NOVES MODES DE PENTINATS,10 MILLES PER VEURE UNA BONA ARMADURA (2011)
"I potser no seré el teu amic, ni tindré res a veure amb si ets o no ets feliç.",CRITICAREM LES NOVES MODES DE PENTINATS,10 MILLES PER VEURE UNA BONA ARMADURA (2011)
Ja em veig de record mig trist que se’t creua pel cap una mala tarda.,CRITICAREM LES NOVES MODES DE PENTINATS,10 MILLES PER VEURE UNA BONA ARMADURA (2011)
I potser dormiré abraçadeta una dona a qui quasi no hauré explicat qui ets.,CRITICAREM LES NOVES MODES DE PENTINATS,10 MILLES PER VEURE UNA BONA ARMADURA (2011)
Que vinguin els anys! Aquí em té la calma!,CRITICAREM LES NOVES MODES DE PENTINATS,10 MILLES PER VEURE UNA BONA ARMADURA (2011)
que un raconet del menjador farà d’escenari i que ningú sospitarà de qui estic parlant.,CRITICAREM LES NOVES MODES DE PENTINATS,10 MILLES PER VEURE UNA BONA ARMADURA (2011)
"I que, quan seré vell, seguiré cantant-te cançons, igual. No sé si estaré per garantir-te una gran qualitat",CRITICAREM LES NOVES MODES DE PENTINATS,10 MILLES PER VEURE UNA BONA ARMADURA (2011)
"però creuré en un verset i em distrauré intentant-lo allargar i em podran veure somriure una mica per sota del nas,",CRITICAREM LES NOVES MODES DE PENTINATS,10 MILLES PER VEURE UNA BONA ARMADURA (2011)
Que sembla tan clar que ens equivoquem com que ho anem a fer.,EL MIQUEL I L'OLGA TORNEN,10 MILLES PER VEURE UNA BONA ARMADURA (2011)
"però, si truca algú, no contesteu, que el cel ja és prou ple de valents.",EL MIQUEL I L'OLGA TORNEN,10 MILLES PER VEURE UNA BONA ARMADURA (2011)
"Guardeu-vos forces, bona gent, potser ens veurem un altre dia.",EL MIQUEL I L'OLGA TORNEN,10 MILLES PER VEURE UNA BONA ARMADURA (2011)
"Sabem que volíeu fer més, però, què hi farem, així és la vida",EL MIQUEL I L'OLGA TORNEN,10 MILLES PER VEURE UNA BONA ARMADURA (2011)
"I, alguna estona, què us penseu?, també ens agrada estar contents.",EL MIQUEL I L'OLGA TORNEN,10 MILLES PER VEURE UNA BONA ARMADURA (2011)
"Ai, Verge Santa del Roser, volem el just per viure bé!",EL MIQUEL I L'OLGA TORNEN,10 MILLES PER VEURE UNA BONA ARMADURA (2011)
"I “Que bonic! Que bonic! Que bonic!” m’he dit,
quina nena més dolça devia ser,
quin plaer haver-la pogut conèixer fa molt de temps.",EN LA QUE EL BERNAT SE'T TROBA,ELS MILLORS PROFESSORS EUROPEUS (2008)
"Però un avís per a navegants,
fes-me cas els dies senars
i els parells fes com qui sent
que a la platja hi xiula el vent.",AVÍS PER A NAVEGANTS,ELS MILLORS PROFESSORS EUROPEUS (2008)
"i que estimes, en el fons,
les meves imperfeccions.",AVÍS PER A NAVEGANTS,ELS MILLORS PROFESSORS EUROPEUS (2008)
"Avui, Dolors, proposa un tema al cantant,
un que es rigui de tu i de mi i d’aquesta història que s’ha anat acabant.","AI, DOLORS",ELS MILLORS PROFESSORS EUROPEUS (2008)
"I, Dolors, ningú esperarà cap escena dolça davant cap portal,
ni, Dolors, cap gran veritat serà revelada quan es faci clar.","AI, DOLORS",ELS MILLORS PROFESSORS EUROPEUS (2008)
"De moment no et riuré més les gràcies,
per una vegada he entès el que cal.",PLA QUINQUENNAL,ELS MILLORS PROFESSORS EUROPEUS (2008)
Pel tercer guardo l’antologia dels grans octosíl•labs que parlen de tu,PLA QUINQUENNAL,ELS MILLORS PROFESSORS EUROPEUS (2008)
I el cinquè ens creuarem per l’Eixample i demanarem taula en un bar de menús.,PLA QUINQUENNAL,ELS MILLORS PROFESSORS EUROPEUS (2008)
"Trauré pit, ensenyant la corbata, i llavors, bonica,
dependrà de tu.",PLA QUINQUENNAL,ELS MILLORS PROFESSORS EUROPEUS (2008)
i ens despertaria un carro pujant per l’empedrat.,ROMA,ELS MILLORS PROFESSORS EUROPEUS (2008)
"Si hagués nascut a Roma, fa més de dos mil anys,
no faria olor de xampú el teu cabell daurat,",ROMA,ELS MILLORS PROFESSORS EUROPEUS (2008)
"I els turistes es fan fotos on tu i jo vam esmorzar,
són les coses bones de passar a l’eternitat,",ROMA,ELS MILLORS PROFESSORS EUROPEUS (2008)
"I ara un nen dibuixa a llapis a la sala del museu
el braçalet de maragdes que t’embolicava el peu",ROMA,ELS MILLORS PROFESSORS EUROPEUS (2008)
"i un submarinista troba els nostres gots i els nostres plats,
són les coses bones de passar a l’eternitat.",ROMA,ELS MILLORS PROFESSORS EUROPEUS (2008)
"Provem d’encaixar en escenes boniques,
en ports de diumenge farcits de gavines,
en grans sobretaules on els avis canten,
en nits vora el foc abraçats a una manta.",CAPTATIO BENEVOLENTIAE,ELS MILLORS PROFESSORS EUROPEUS (2008)
"Es tracta de ser els simpàtics del barri,
els que ballen i ballen fins que els músics parin",CAPTATIO BENEVOLENTIAE,ELS MILLORS PROFESSORS EUROPEUS (2008)
"I, a vegades, ens en sortim.",CAPTATIO BENEVOLENTIAE,ELS MILLORS PROFESSORS EUROPEUS (2008)
"I, a vegades, una tonteria de sobte ens indica que ens en sortim.",CAPTATIO BENEVOLENTIAE,ELS MILLORS PROFESSORS EUROPEUS (2008)
"I, a vegades, una carambola de sobte ens demostra que ens en sortim.",CAPTATIO BENEVOLENTIAE,ELS MILLORS PROFESSORS EUROPEUS (2008)
i afronten la vida mirant-la a la cara,CAPTATIO BENEVOLENTIAE,ELS MILLORS PROFESSORS EUROPEUS (2008)
"Intentem trampejar per ser persones dignes,
el pare modèlic que volen les filles,
el de la veu greu, el de la mà forta,
que paga un vermut i que arregla una porta.",CAPTATIO BENEVOLENTIAE,ELS MILLORS PROFESSORS EUROPEUS (2008)
"havent enllestit un gran epitafi
que arranqui somriures a tots els que passin.",CAPTATIO BENEVOLENTIAE,ELS MILLORS PROFESSORS EUROPEUS (2008)
"I, a vegades, se’ns baixa la verge i de sobte ens revela que ens en sortim.",CAPTATIO BENEVOLENTIAE,ELS MILLORS PROFESSORS EUROPEUS (2008)
"I, a vegades, contra tot pronòstic una gran bestiesa capgira allò que crèiem lògic,
tot fent evident,
que per un moment,
ens en sortim.",CAPTATIO BENEVOLENTIAE,ELS MILLORS PROFESSORS EUROPEUS (2008)
"Qui s’arrisca a fracassar?
Qui saltarà sense xarxa?",NIT FREDA PER SER ABRIL,ELS MILLORS PROFESSORS EUROPEUS (2008)
"Marxaríem els dos junts
d’aquesta ciutat tan rara",NIT FREDA PER SER ABRIL,ELS MILLORS PROFESSORS EUROPEUS (2008)
"Ell demà serà capaç,
ella demà estarà més guapa.",NIT FREDA PER SER ABRIL,ELS MILLORS PROFESSORS EUROPEUS (2008)
"És nit freda per ser abril
no s’està enlloc com a casa.",NIT FREDA PER SER ABRIL,ELS MILLORS PROFESSORS EUROPEUS (2008)
tu i jo volàvem en un Ford Fiesta groc,AL MAR!,ELS MILLORS PROFESSORS EUROPEUS (2008)
tu i jo hem cantat a la vora del foc.,AL MAR!,ELS MILLORS PROFESSORS EUROPEUS (2008)
tu i jo hem tingut el cap ple de pardals,AL MAR!,ELS MILLORS PROFESSORS EUROPEUS (2008)
"Molt lluny d’aquí, a l’altra banda del món,
hi ha una xiringuito amb quatre pins al fons,",AL MAR!,ELS MILLORS PROFESSORS EUROPEUS (2008)
Però no saben que ser atractius també pot comportar viure en un malson!,ELS GUAPOS SÓN ELS RAROS,ELS MILLORS PROFESSORS EUROPEUS (2008)
"No saben que els guapos són els raros,
que ho sap tothom però no ho diu ningú,",ELS GUAPOS SÓN ELS RAROS,ELS MILLORS PROFESSORS EUROPEUS (2008)
"No saben que els guapos són els raros,
que ho sap tothom però no ho diu ningú,
tampoc no s’agraden i tenen complexos per ser diferents.",ELS GUAPOS SÓN ELS RAROS,ELS MILLORS PROFESSORS EUROPEUS (2008)
"Mentre ballem em mullen les aigües del Rin,
entro amb un tanc rus a Berlín,
m’espanta el teu passat víking.",DONA ESTRANGERA,ELS MILLORS PROFESSORS EUROPEUS (2008)
"Mentre ens besem entre copes d’arbres gegants,
ta mare resa a déus estranys,
ton pare educa uns elefants.",DONA ESTRANGERA,ELS MILLORS PROFESSORS EUROPEUS (2008)
