Frase,Cançó,Disc
"Quan fem l’amor dos-cents dansaires otomans
giren contents al meu voltant
somriuen i piquen de mans.",DONA ESTRANGERA,ELS MILLORS PROFESSORS EUROPEUS (2008)
"El teu estil em fascina.
On has estat tot aquest temps?",CERÀMIQUES GUZMÁN,ELS MILLORS PROFESSORS EUROPEUS (2008)
"Una amiga molt amiga venia massa sovint
i ens ha costat déu i ajuda arribar fins aquí.",CORRANDES DE LA PARELLA ESTABLE,ELS MILLORS PROFESSORS EUROPEUS (2008)
"Jo sempre compro manxego malgrat que ella és més de brie
i ens ha costat déu i ajuda arribar fins aquí.",CORRANDES DE LA PARELLA ESTABLE,ELS MILLORS PROFESSORS EUROPEUS (2008)
"Jo sóc un fan de l’Astèrix i ella té tots els tintins,
ens ha costat déu i ajuda arribar fins aquí.",CORRANDES DE LA PARELLA ESTABLE,ELS MILLORS PROFESSORS EUROPEUS (2008)
"Jo dic “eps, un ron amb cola!” i ella vol carta de vins
i ens ha costat déu i ajuda arribar fins aquí.",CORRANDES DE LA PARELLA ESTABLE,ELS MILLORS PROFESSORS EUROPEUS (2008)
"Jo ja sé dos o tres coses, ella ja en sap quatre o cinc,
que ens ha costat déu i ajuda arribar fins aquí.",CORRANDES DE LA PARELLA ESTABLE,ELS MILLORS PROFESSORS EUROPEUS (2008)
"Ella és reina de les festes, jo sóc un home avorrit,
i ens ha costat déu i ajuda arribar fins aquí.",CORRANDES DE LA PARELLA ESTABLE,ELS MILLORS PROFESSORS EUROPEUS (2008)
"Jo la miro i m’espanto no fos que es cansés de mi,
ens ha costat déu i ajuda arribar fins aquí.",CORRANDES DE LA PARELLA ESTABLE,ELS MILLORS PROFESSORS EUROPEUS (2008)
